Page,Section,Family,EnglishCommon,LatinSpecies,Length,Voice,,
334,Tyrant Flycatchers,Tyrannidae,Tufted Flycatcher,Mitrephanes phaeocercus,13cm,"Call is a whistled ""tchurree-tchurree"". Sometimes given singly; also a soft ""peek"" like Hammond's Flycatcher.",,
334,Tyrant Flycatchers,Tyrannidae,Olive-sided Flycatcher,Contopus cooperi,19cm,"Distinctive loud, clear three-part song. Across boreal north from AK to NL ""quick-three-beers"" with slight emphasis on last note. In western U.S. ""what-peeves-you"" with clear emphasis on longer, higher middle note. The current ranges for the two described ssp. do not reflect these vocal differences. Typical call is a repeated ""pip"".",,
334,Tyrant Flycatchers,Tyrannidae,Greater Pewee,Contopus pertinax,20cm,"Song is a whistled ""ho-say ma-re-ah""; call is a repeated ""pip"".",,
336,Tyrant Flycatchers,Tyrannidae,Easter Wood-Pewee,Contopus virens,16cm,"Distinctive song is a clear, slow, plaintive ""pee-a-wee"", the second note lower; this phrase often alternates with a downslurred ""pee-yer"". Calls include a loud ""chip"" and clear, whistled ""pweee"" notes; often given together, ""chip pweee"".",,
336,Tyrant Flycatchers,Tyrannidae,Western Wood-Pewee,Contopus sordidulus,16cm,"Calls include a harsh, slightly descending ""peeer"" and clear whistles suggestive of Eastern's ""pee-yer"". Song, heard chiefly on breeding grounds, has three-note phrases mixed with the ""peeer"" note.",,
336,Tyrant Flycatchers,Tyrannidae,Cuban Pewee,Contopus caribaeus,15cm,"Call is a clear, steady ""dee-dee-dee"", also a soft ""dep"" note.",,
336,Empidonax Flycatchers,Tyrannidae,Acadian Flycatcher,Empidonax virescens,15cm,"Call is a soft ""peace"", extended in song to an emphatic ""pee-tsup"". On breeding grounds, also gives a flickerlike ""ti ti ti ti ti"".",,
338,Empidonax Flycatchers,Tyrannidae,Yellow-bellied Flycatcher,Empidonax flaviventris,14cm,"Song, a liquid ""je-bunk""; also a plaintive, rising ""per-wee"", both heard mainly on breeding grounds. Call is a sharp, whistled ""chiu"", heard in migration and on winter grounds, that sounds somewhat like Acadian.",,means Acadian Flycatcher here
338,Empidonax Flycatchers,Tyrannidae,Alder Flycatcher,Empidonax alnorum,15cm,"Best identified by voice. Call, a loud ""pip"", similar to Hammond's but lower, sharper; heard year-round. Distinctive song, a falling, wheezy ""weeb-ew"" is heard mainly on breeding grounds, but also by some spring migrants. On breeding grounds, also gives a descending ""wheer"".",,
338,Empidonax Flycatchers,Tyrannidae,Willow Flycatcher,Empidonax traillii,15cm,"Call is a liquid ""wit"". Songs, a sneezy ""fitz-bew""; on breeding grounds, also a rising ""brreet""; often sings in spring migration.",,
340,Empidonax Flycatchers,Tyrannidae,Least Flycatcher,Empidonax minimus,13cm,"Song, a dry ""che-bek"" accented on the second syllable, is usually delivered in a rapid series; call, a sharp ""whit"", is sometimes also given in a series. Most vocal empid in migration.",,
340,Empidonax Flycatchers,Tyrannidae,Hammond's Flycatcher,Empidonax hammondii,14cm,"Call note, a sharp ""peek"". Song, heard only on breeding grounds, like Dusky, but hoarser and lower pitched, especially on second note.",,means Dusky Flycatcher here
340,Empidonax Flycatchers,Tyrannidae,Gray Flycatcher,Empidonax wrightii,15cm,"Song is a vigorous ""chi-wip"" or ""chi-bit"", followed by a liquid ""whilp"", trailing off in a gurgle. Call is a loud ""wit"".",,
340,Empidonax Flycatchers,Tyrannidae,Dusky Flycatcher,Empidonax oberholseri,15cm,"Calls include a ""wit"" note, softer than Gray Flycatcher; a mournful ""deehic"", heard on breeding grounds. Song has several phrases: a clear ""sillit""; an upslurred ""ggrrreep""; another high ""sillit"", often omitted; and a clear, high ""pweet"".",,
342,Empidonax Flycatchers,Tyrannidae,Pacific-slope Flycatcher,Empidonax difficilis,14cm,"Call is a sharp ""seet""; male gives upslurred ""psee-yeet"" note. Song is a complex series of notes, including call notes.",,
342,Empidonax Flycatchers,Tyrannidae,Cordilleran Flycatcher,Empidonax occidentalis,15cm,"Separable in field only by male's call, a two-note upslurred ""see seet""; some populations in northwestern portion of breeding range give more intermediate notes. This fits with the new genetic evidence that reveals a wide swath in northwest part of range where birds have intermediate DNA, raising the issue of whether the two should be lumped. ""Seet"" note seems slightly sharper in Cordilleran than Pacific-slope Flycatcher.",,
342,Empidonax Flycatchers,Tyrannidae,Pine Flycatcher,Empidonax affinis,14cm,"Call a sharp ""whip"", a bit louder, lower pitched than Dusky. Song of northern populations (in Mexico) consists of two to four hesitant phrases.",,
342,Empidonax Flycatchers,Tyrannidae,Buff-breasted Flycatcher,Empidonax fulvifrons,13cm,"Call a soft ""pwit"". Typical song is a quick ""chicky-whew"" or ""chee-lick"".",,
344,Empidonax Flycatchers,Tyrannidae,Eastern Phoebe,Sayornis phoebe,18cm,"Distinctive song is a harsh, emphatic ""fee-be"", accented on the first syllable. Typical call note is a sharp ""chip"".",,
344,Empidonax Flycatchers,Tyrannidae,Black Phoebe,Sayornis nigricans,17m,"Four-syllable song is a rising ""pee-wee"" followed by a descending ""pee-wee"". Calls include a loud ""tseee"" and a sharper ""tsip"", slightly more plaintive than Eastern Phoebe's call.",,
344,Empidonax Flycatchers,Tyrannidae,Say's Phoebe,Sayornis saya,19cm,"Song is a fast ""pit-tse-ar"", often given in fluttering flight. Typical call is a plaintive, whistled ""pee-ee"", slightly downslurred.",,
344,Empidonax Flycatchers,Tyrannidae,Vermilion Flycatcher,Pyrocephalus rubinus,15cm,"Male in breeding season sings during fluttery display flight with chest out. Song is a soft, tinkling ""pit-a-see pit-a-see""; also sings while perched. Typical call is a sharp, thin ""pseep"".",,
346,Myiarchus Flycatchers,Tyrannidae,Brown-crested Flycatcher,Myiarchus tyrannulus,22cm,"Song, a clear musical whistle, a rolling *whit-will-do*. Call, sharp ""whit"".",,
346,Myiarchus Flycatchers,Tyrannidae,Great Crested Flycatcher,Myiarchus crinitus,22cm,"Distinctive call, a loud whistled ""wheep"", sometimes given in a quick series. Song is a clear, loud ""queeleep queelur qurrleep"".",,
346,Myiarchus Flycatchers,Tyrannidae,Dusky-capped Flycatcher,Myiarchus tuberculifer,17cm,"Most frequent call is a mournful, descending ""peeur"".",,
346,Myiarchus Flycatchers,Tyrannidae,Ash-throated Flycatcher,Myiarchus cinerascens,20cm,"Distinctive call, heard year-round, is a rough ""prrrt"". Song, heard on breeding grounds, is a series of burry ""ka-brick"" notes.",,
348,Myiarchus Flycatchers,Tyrannidae,La Sagra's Flycatcher,Myiarchus sagrae,19cm,"Distinctive call, a rather high-pitched ""wink"", is often doubled.",,
348,Myiarchus Flycatchers,Tyrannidae,Nutting's Flycatcher,Myiarchus nuttingi,18cm,"Call a rather sharp ""weep"", suggestive of Great Crested.",means Great Crested Flycatcher here,
348,Myiarchus Flycatchers,Tyrannidae,Piratic Flycatcher,Legatus leucophaius,15cm,"On breeding grounds, song is a strident ""whee-ee"", often followed by a rolled ""ji-ji-jit""; also gives rising and falling whistles.",,
348,Myiarchus Flycatchers,Tyrannidae,Variegated Flycatcher,Empidonomus varius,18cm,"Call is a high, thin ""pseee"".",,
348,Myiarchus Flycatchers,Tyrannidae,Sulphur-bellied Flycatcher,Myiodynastes luteiventris,22cm,"Loud call is an excited chatter, like the squeaking of a rubber duck. Song is a soft ""tre-le-re-re"".",,
350,Myiarchus Flycatchers,Tyrannidae,Cassin's Kingbird,Tyrannus vociferans,23cm,"Call is a short, loud ""chi-bew"", accented on second syllable.",,
350,Myiarchus Flycatchers,Tyrannidae,Western Kingbird,Tyrannus verticalis,22cm,"Common call is a sharp ""whit"".",,
350,Myiarchus Flycatchers,Tyrannidae,Couch's Kingbird,Tyrannus couchii,23cm,"Distinctive calls, a shrill, rolling ""breeeer""; and a more common ""kip"", similar to call of Western Kingbird, given singly or in a series.",,
350,Myiarchus Flycatchers,Tyrannidae,Tropical Kingbird,Tyrannus melancholicus,23cm,"Distinctive call is a rapid, twittering ""pip-pip-pip-pip"".",,
352,Myiarchus Flycatchers,Tyrannidae,Gray Kingbird,Tyrannus dominicensis,23cm,"Song is a buzzy ""pecheer-ry"", accented on second syllable.",,
352,Myiarchus Flycatchers,Tyrannidae,Eastern Kingbird,Tyrannus tyrannus,22cm,"Call is a harsh ""dzeet"" note, also given in a series.",,
352,Myiarchus Flycatchers,Tyrannidae,Fork-tailed Flycatcher,Tyrannus savana,37cm,"Vagrants to U.S. mostly silent. Gives sharp ""sik"" notes and buzzy chattering calls.",,
352,Myiarchus Flycatchers,Tyrannidae,Scissor-tailed Flycatcher,Tyrannus forficatus,33cm,Calls similar to Western Kingbird.,,
354,Myiarchus Flycatchers,Tyrannidae,Thich-billed Kingbird,Tyrannus crassirostris,24cm,"Common call is a loud, high, whistled ""pureet"".",,
354,Myiarchus Flycatchers,Tyrannidae,Loggerhead Kingbird,Tyrannus caudifasciatus,23cm,"Nominate's calls include a loud buzzy ""tireet"", often repeated. Wings produce a muffled sound in flight.",,
354,Myiarchus Flycatchers,Tyrannidae,Great Kiskadee,Pitangus sulphuratus,25cm,"Song is a deliberate ""kis-ka-dee""; call is a loud ""kreak"".",,
354,Becards/Tityras/Allies,Tityridae,Rose-throated Becard,Pachyramphus aglaiae,18cm,"Call, thin, mournful ""seeoo"", sometimes preceded by chatter.",,
356,Shrikes,Laniidae,Brown Shrike,Lanius cristatus,19cm,NA,,
356,Shrikes,Laniidae,Loggerhead Shrike,Lanius ludovicianus,23cm,"Song is a medley of low warbles and harsh, squeaky notes; calls include a harsh ""shack-shack"".",,
356,Shrikes,Laniidae,Northern Shrike,Lanius excubitor,25cm,Song and calls are similar to Loggerhead.,means Loggerhead Shrike here,
358,Vireos,Vireonidae,Black-capped Vireo,Vireo atricapilla,11cm,"Song a persistent string of varied, choppy, two- or three-note phrases. Call note, ""tsidik"", quite similar to Ruby-crowned Kinglet.",,
358,Vireos,Vireonidae,White-eyed Vireo,Vireo griseus,13cm,"Typical song is a loud, variable five-to seven-note phrase usually beginningand ending with a sharp ""chick""; als gives a chatter call suggestive of House Wren. Song incorporates parts of songs of other species.",,
358,Vireos,Vireonidae,Thick-billed Vireo,Vireo crassirostris,14cm,Song is similar but harsher; call notes slower and harsher.,means White-eyed Vireo here,
358,Vireos,Vireonidae,Hutton's Vireo,Vireo huttoni,13cm,"Song is a repeated or mixed rising ""zu-wee"" and descending ""zoe zoo""; also a flat ""chew"". Calls include a low ""chit"" and whining chatter; birds from interior Southwest give a harsher ""tchurr-ree"".",,
360,Vireos,Vireonidae,Bell's Vireo,Vireo bellii,12cm,Song is a series of scolding notes. Call notes like House Wren.,,
360,Vireos,Vireonidae,Gray Vireo,Vireo vicinior,14cm,"Song is a series of musical ""chu-wee chu-weet"" notes, faster and sweeter than Plumbeous. Calls include a shrill, descending musical notes, often delivered in flight, as is song.",,
360,Vireos,Vireonidae,Plumbeous Vireo,Vireo plumbeus,13cm,"Song is hoarser than Blue-headed, very like Cassin's; call similar.",means Blue-headed Vireo and Cassin's Vireo here,
360,Vireos,Vireonidae,Cassin's Vireo,Vireo cassinii,13cm,"Song is haorser than Blue-headed, like Plumbeous; call similar.",means Blue-headed Vireo and Plumbeous Vireo here,
360,Vireos,Vireonidae,Blue-headed Vireo,Vireo solitarius,13cm,"Song similar to Red-eyed, but slower, sweeter. Call a harsh chatter.",means Red-eyed Vireo here,
362,Vireos,Vireonidae,Yellow-throated Vireo,Vireo flavifrons,14cm,"Song, a slow repetition of buzzy, low-pitched two- or three-note phrases separated by long pauses, often contains a rising *three-eight*. Calls include a rapid, harsh series of ""cheh"" notes.",,
362,Vireos,Vireonidae,Yellow-green Vireo,Vireo flavoviridis,15cm,"Song is a rapid but hesitant series of notes, suggesting House Sparrow.",,
362,Vireos,Vireonidae,Red-eyed Vireo,Vireo aolivaceus,15cm,"Persistent song, sung all day, a variable series of sweet, deliberate short pauses, often doubled. Calls include a nasal, whining ""quee"".",,
362,Vireos,Vireonidae,Black-whiskered Vireo,Vireo altiloquus,16cm,"Song, deliberate one- to four-note phrases, less varied and more emphatic than Red-eyed.",,
364,Vireos,Vireonidae,Philadelphia Vireo,Vireo philadelphicus,13cm,"Song very similar to Red-eyed but generally slower, thinner.",means Red-eyed Vireo here,
364,Vireos,Vireonidae,Warbling Vireo,Vireo gilvus,14cm,"Song of gilvus delibered in long, melodious, warbling phrases ending with sharp, higher note (""squirt""); song of swainsoni less musical and choppier, with higher ones and break near beginning. Calls include a peevish rising ""cheee"" and low ""chut"" notes. Apparently does not interbreed where the two ssp. come together in AB.",,
364,Crows/Jays,Corvidae,Clark's Nutcracker,Nucifraga columbiana,31cm,"Calls include a very nasal, grating, drawn-out ""kra-a-a"".",,
364,Crows/Jays,Crows/Jays,Gray Jay,Perisoreus canadensis,29cm,"Highly variable call notes include whistled ""wheeoo"" and low ""chuck"".",,
366,Crows/Jays,Crows/Jays,Green Jay,Cyanocorax yncas,27cm,"Gregarious and noisy; most common call is a series of raspy ""cheh-cheh-cheh"" notes.",,
366,Crows/Jays,Crows/Jays,Brown Jay,Psilorhinus morio,42cm,A noisy species; its harsh scream is similar to the call of Red-shouldered Hawk. Another call sounds like a hiccup.,,
366,Crows/Jays,Crows/Jays,Pinyon Jay,Gymnorhinus cyanocephalus,27cm,"Typical flight call is a high-pitched, piercing ""mew"", audible over long distances. Also gives a rolling series of ""queh"" notes.",,
366,Crows/Jays,Crows/Jays,Blue Jay,Cyanocitta cristata,28cm,"Most common of varied calls is a piercing ""jay jay jay""; also gives a musical ""weedle-eedle"" and mimics the call of Red-shouldered Hawk.",,
366,Crows/Jays,Crows/Jays,Steller's Jay,Cyanocitta stelleri,29cm,"Calls include a series of ""shack"" or ""shooka"" notes and other calls suggestive of Red-shouldered and Red-tailed Hawks.",,
368,Crows/Jays,Crows/Jays,California Scrub-Jay,Aphelocoma californica,28cm,"Calls include a raspy ""shreep"" often in a short series.",,
368,Crows/Jays,Crows/Jays,Woodhouse's Scrub-Jay,Aphelocoma woodhouseii,28cm,"Calls similar to California, but somewhat higher pitched.",means California Scrub-Jay here,
368,Crows/Jays,Crows/Jays,Florida Scrub-Jay,Aphelocoma coerulescens,28cm,"Varied calls include raspy, hoarse notes.",,
368,Crows/Jays,Crows/Jays,Island Scrub-Jay,Aphelocoma insularis,30cm,"Calls similar to California, but slightly lower and deeper.",means California Scrub-Jay here,
368,Crows/Jays,Crows/Jays,Mexican Jay,Aphelocoma wollweberi,29cm,"Calls include a loud, ringing ""week"", given singly or in a series; similar in both ssp. groups.",,
370,Crows/Jays,Crows/Jays,Black-billed Magpie,Pica hudsonia,48cm,"Noisy; many calls, one a whining ""mag"", another a mellow ""wurp"".",,
370,Crows/Jays,Crows/Jays,Yellow-billed Magpie,Pica nuttalli,42cm,Calls are similar to Black-billed.,means Black-billed Magpie here,
370,Crows/Jays,Crows/Jays,Eurasian Jackdaw,Corvus monedula,33cm,"Calls include a metallic ""kow"" and a softer ""jack"" note.",,
370,Crows/Jays,Crows/Jays,Tamaulipas Crow,Corvus imparatus,37cm,"Call is a low, froglike ""croak"".",,
370,Crows/Jays,Crows/Jays,Northwestern Crow,Corvus caurinus,41cm,"Call is somewhat hoarser and lower than American, but beware of juvenile American crow.",,
372,Crows/Jays,Crows/Jays,Fish Crow,Corvus ossifragus,39cm,"Always best distinguished by voice: Call is a high, nasal ""uh uh"", the second note lower; also low, short ""car"" notes.",,
372,Crows/Jays,Crows/Jays,American Crow,Corvus brachyrhynchos,45cm,"Adult is readily identified by familiar ""caw"" call, but juvenile's higher-pitched, nasal ""cah"" begging call resembles the call of the similar Fish Crow.",,
372,Crows/Jays,Crows/Jays,Chihuahuan Raven,Corvus cryptoleucus,50cm,"Frequent call, a drawn-out ""croak"", usually slightly higher pitched than Common Raven.",,
372,Crows/Jays,Crows/Jays,Common Raven,Corvus corax,61cm,"Most common call is a low, drawn-out ""croak"".",,
374,Larks,Alaudidae,Horned Lark,Eremophila alpestris,17-20cm,"Calls include a high ""tsee-ee"" or ""tsee-titi"". Song is a weak twittering, delivered from the ground or in flight.",,
376,Larks,Alaudidae,Eurasian Skylark,Alauda arvensis,18cm,"Song is a continuous outpouring of trills and warblings, delivered in high hovering or circling song flight. Call is a liquid ""chirrup"" with buzzy overtones.",,
376,Swallows,Hirundinidae,Purple Martin,Progne subis,20cm,"Loud , rich gurgling and whistles; also a low ""churr"".",,
376,Swallows,Hirundinidae,Brown-chested Martin,Progne tapera,16cm,NA,,
376,Swallows,Hirundinidae,Bahama Swallow,Tachycineta cyaneoviridis,15cm,NA,,
378,Swallows,Hirundinidae,Tree Swallow,Tachycineta bicolor,15cm,Calls and song include whistles and liquid gurgles or chirps.,,
378,Swallows,Hirundinidae,Violet-green Swallow,Tachycineta thalassina,13cm,Gives rapid and high-pitched twittering notes.,,
378,Swallows,Hirundinidae,Common House-Martin,Delichon urbicum,13cm,"Call, a rough scratchy ""prrit"", somewhat similar to Rough-winged Swallow.",,
378,Swallows,Hirundinidae,Barn Swallow,Hirundo rustica,17cm,"Call is a short, sweet, single or double ""vit"" or ""veet""; song is a series of squeaky notes.",,
380,Swallows,Hirundinidae,Northern Rough-winged Swallow,Stelgidopteryx serripennis,13cm,"Call is a low, buzzy ""zzrtt"".",,
380,Swallows,Hirundinidae,Bank Swallow,Riparia riparia,12cm,"Call is a series of buzzy, short ""dzrrt"" notes, not unlike the sound made by high-tension powerlines.",,
380,Swallows,Hirundinidae,Cliff Swallow,Petrochelidon pyrrhonata,14cm,"Calls include a rough, squeaky ""chri"", a nasal ""trrr"", and a rattle.",,
380,Swallows,Hirundinidae,Cave Swallow,Petrochelidon fulva,14cm,"Call is a rising ""pweih"", much sweeter than Cliff Swallow.",,
382,Chickadees/Titmice,Paridae,Bridled Titmouse,Baeolophus wollweberi,13cm,"Most common callis a rapid, high-pitched variation of ""chick-a-dee-dee"", similar to Juniper Titmouse. Song is a rapid and clipped series of whistled notes.",,
382,Chickadees/Titmice,Paridae,Oak Titmouse,Baeolophus inornatus,13cm,"Song is variable, a repeated series of syllables made up of whistled, alternating, high and low notes. Call is a hoarse ""tschick-a-dee"".",,
382,Chickadees/Titmice,Paridae,Tufted Titmouse,Baeolophus bicolor,16cm,"Typical song is a loud, whistled ""peter peter peter""; less vocal than Black-crested; calls softer and less nasal.",means Black-crested Titmouse here,
382,Chickadees/Titmice,Paridae,Juniper Titmouse,Baeolophus ridgwayi,13cm,"Song is a rolling series of syllables, rapid, with uniform pitch. Call is a hoarse ""tschick-a-dee"" similar to Bridled Titmouse. Overall, chattering call notes are more clipped and delivered much more rapidly than Oak Titmouse.",,
382,Chickadees/Titmice,Paridae,Black-crested Titmouse,Baeolophus atricristatus,15cm,"Calls louder, sharper than Tufted. Song is also like Tufted, but notes are slightly higher and are delivered more rapidly.",means Tufted Titmouse here,
384,Chickadees/Titmice,Paridae,Black-capped Chickadee,Poecile atricapillus,13cm,"Best distinction is voice. Call is a lower, slower ""chick-a-dee-dee-dee"" than Carolina; typical song, a clear, whistled ""fee-bee"" or ""fee-bee-ee"", the first note higher in pitch; vocalizations show considerable geographic variation.",,
384,Chickadees/Titmice,Paridae,Carolina Chickadee,Poecile carolinensis,12cm,"Best distinction for separating species is voice. Call is a higher, faster version of ""chick-a-dee-dee-dee"" than Black-capped; typical song is a four-note whistle, ""fee-bee fee-bay"".",means Black-capped Chickadee here,
384,Chickadees/Titmice,Paridae,Mexican Chickadee,Poecile sclateri,13cm,"Song is a warbled whistle; call note, a husky buzz.",,
384,Chickadees/Titmice,Paridae,Mountain Chickadee,Poecile gambeli,13cm,"Call is a hoarse ""chick-adee-dee-dee""; typical song, a three- or four-note descending whistle, ""fee-bee-bay"" or ""fee-bee fee-bee"".",,
386,Chickadees/Titmice,Paridae,Chestnut-backed Chickadee,Poecile rufescens,12cm,"Call a high, hoarse, rapid ""tseek-a-dee-dee"". No whistled song given.",,
386,Chickadees/Titmice,Paridae,Boreal Chickadee,Poecile hudsonicus,14cm,"Call is a nasal ""tseek-a-day-day"".",,
386,Chickadees/Titmice,Paridae,Gray-headed Chickadee,Poecile cinctus,14cm,"Call is a distinctive series of ""dee-deer"" notes.",,
386,Penduline Tits/Verdins,Remizidae,Verdin,Auriparus flaviceps,11cm,"Song is a plaintive three-note whistle, the second note higher. Calls include rapid chip notes and a single sharp ""seep"".",,
386,Long-tailed tits/Bushtits,Aegithalidae,Bushtit,Psaltriparus minimus,11cm,"Calls from coastal slope birds a rapid, soft twittering, given in loud, excited chatter when raptor appears; interior birds give sharper notes.",,
388,Nuthatches,Sittidae,Red-breasted Nuthatch,Sitta canadensis,11cm,"High-pitched, nasal call sounds like a toy tin horn.",,
388,Nuthatches,Sittidae,White-breasted Nuthatch,Sitta carolinensis,15cm,"Song of eastern carolinensis and Pacific aculeata is a series of whistled ""tuey"" notes on one pitch; lower in carolinensis. Call is a low-pitched ""yank"" in carolinensis, a higher-pitched ""wheer"" in aculeata, and a rising series of even higher ""yida"" notes in lagunae group. Song of latter varied, but often consists of a series of their calls.",,
388,Nuthatches,Sittidae,Pygmy Nuthatch,Sitta pygmaea,11cm,"Typical calls, a high ""peep"" or a rapid ""peep peep""; als a piping ""wee-bee""; grouped in three or more notes in nominate ssp., pygmaea.",,
388,Nuthatches,Sittidae,Brown-headed Nuthatch,Sitta pusilla,11cm,"Call is a repeated double note like the squeak of a rubber duck. Feeding flocks also give twittering, chirping, and talky ""bit bit bit"" calls.",,
390,Creepers,Certhiidae,Brown Creeper,Certhia americana,13cm,"Call is a soft, sibilant ""see""; song, a high-pitched, variable ""see see see titi see"" with differences between eastern and western ssp. Groups; vocalizations of albescens appear distinct but local dialects complicate situation; more study needed.",,
390,Wrens,Troglodytidae,Rock Wren,Salpinctes obsoletus,15cm,"Song variable mixes of buzzes and trills; call buzzy ""tick-ear"" or ""dzeeeee"".",,
390,Wrens,Troglodytidae,Canyon Wren,Catherpes mexicanus,15cm,"Loud, silvery song, a deccelerating, descending series of liquid ""tee"" and ""tew"" notes. Typical call is a sharp, buzzy ""jeet"".",,
390,Wrens,Troglodytidae,Cactus Wren,Campylorhynchus brunneicapillus,22cm,"Song, heard all year, is a low-pitched, harsh, rapid ""cha cha cha cha cha"". Call is a variety of low, croaking notes, sometimes in a series.",,
392,Wrens,Troglodytidae,House Wren,Troglodytes aedon,12cm,"Exuberant song is a cascade of bubbling whistled notes; calls include a soft ""chek"" and a harsh scold; also in western birds a rolled ""trrrrr"".",,
392,Wrens,Troglodytidae,Pacific Wren,Troglodytes pacificus,9-11cm,"Call is a ""chimp"", often doubled, quality like Wilson's Warbler. Song is like Winter Wren, but faster, less melodic.",,
392,Wrens,Troglodytidae,Winter Wren,Troglodytes hiemalis,9cm,"Most frequent call is ""kelp"", often doubled and highly suggestive of Song Sparrow but sharper. Song is a beautiful series of musical trills.",,
392,Wrens,Troglodytidae,Carolina Wren,Thryothorus ludovicianus,14cm,"Vivacious, melodious song, a loud, clear *teakettle tea-kettle teakettle* or *cheery cheery cheery*. Sings all year. Calls are loud and varied and include a ""chirt"" or double ""chirt-eet"".",,
394,Wrens,Troglodytidae,Marsh Wren,Cistothorus palustris,13cm,"Songs are mechanical-sounding mix of bubbling and trilling notes; more liquid in East, harsher, faster, and much more variable in West. Alarm call is a sharp ""tsuk"" often doubled.",,
394,Wrens,Troglodytidae,Sedge Wren,Cistothorus platensis,11cm,"Song begins with a few single notes followed by a weak staccato trill or chatter; call note, a rich ""chip"", often doubled.",,
394,Wrens,Troglodytidae,Sinaloa Wren,Thryophilus sinaloa,13cm,"Song consists of loud rich phrases, often with rapid repetition of notes; wide variety of call notes.",,
394,Wrens,Troglodytidae,Bewick's Wren,Thryomanes bewickii,13cm,"Song variable, a high, thin buzz and warble, similar to Song Sparrow. Calls include a flat, hollow ""jip"".",,
396,Gnatcatchers/Gnatwrens,Poliopilidae,Blue-gray Gnatcatcher,Polioptila caerulea,11cm,"Call is a querulous ""pwee"". Varied song of high, thin notes, chips and buzzy notes; harsher in slightly duller-plumaged western obscura.",,
396,Gnatcatchers/Gnatwrens,Poliopilidae,Black-capped Gnatcatcher,Polioptila nigriceps,11cm,Calls quite suggestive of most frequent call of Bewick's Wren.,,
396,Gnatcatchers/Gnatwrens,Poliopilidae,Black-taied Gnatcatcher,Polioptila melanura,10cm,"Calls include rasping ""cheeh"" and hissing ""ssheh""; song is a rapid series of ""jee"" notes; all vocalizations harsher than Blue-gray.",means Blue-gray Gnatatcher,
396,Gnatcatchers/Gnatwrens,Poliopilidae,California Gnatcatcher,Polioptila californica,11cm,"Call is a rising and falling, kittenlike ""zeeer""; song is a series of ""jzer"" or ""zew"" notes.",,
398,Dippers,Cinclidae,American Dipper,Cinclus mexicanus,19cm,"Song is loud, musical, wrenlike. Call, a sharp, loud ""dzeet"", often given in a series, and in flight.",,
398,Kinglets,Regulidae,Golden-crowned Kinglet,Regulus satrapa,10cm,"Call is a series of high, thin ""tsee"" notes. Song, almost inaudibly high, is a series of ""tsee"" notes accelerating into a trill.",,
398,Kinglets,Regulidae,Ruby-crowned Kinglet,Regulus calendula,11cm,"Call is a scolding ""je-ditt"". Song, high, thin ""tsee"" notes followed by descending ""tew"" notes, ends with warbled three-note phrases.",,
