Page,Section,Family,EnglishCommon,LatinSpecies,Length,Voice,,
14,Geese,Anatidae,Greater White-fronted Goose,Anser albifrons,71cm,"Call is a high-pitched, laughing ""kah-lah-aluck""; calls of 'elgasi' described as hoarser and lower pitched than other ssp.",,
14,Geese,Anatidae,Tundra Bean-Goose,Anser serrirostris,71-84cm,Calls said to be higher pitched than Taiga Bean-Goose.,,
14,Geese,Anatidae,Taiga Bean-Goose,Anser fabalis,76-89cm,"Calls loud and deep, very different from Greater White-fronted.",,
16,Geese,Anatidae,Pink-footed Goose,Anser brachyrhynchus,66cm,NA,,
16,Geese,Anatidae,Snow Goose,Chen caerulescens,66-84cm,Gives single high-pitched calls.,,
16,Geese,Anatidae,Ross's Goose,Chen rossii,58cm,Calls are higher pitched and delivered more rapidly than Snow Goose.,,
18,Geese,Anatidae,Emperor Goose,Chen canagica,66cm,"Calls include a high-pitched, hoarse ""kla-ha"". Less vocal than other geese.",,
18,Geese,Anatidae,Barnacle Goose,Branta leucopsis,69cm,High-pitched cackling.,,
18,Geese,Anatidae,Brant,Branta bernicla,64cm,"Call is a low, rolling, slightly upslurred ""raunk-raunk"".",,
20,Geese,Anatidae,Egyptian Goose,Alopochen aegyptiacus,64-74cm,"Males give hissing calls, females harsh quacking or trumpeting.",,
20,Geese,Anatidae,Canada Goose,Branta canadensis,76-109cm,"Call is a deep, musical ""honk-a-lonk"".",,
20,Geese,Anatidae,Cackling Goose,Branta hutchnsii,58-84cm,"Calls of all ssp. are higher pitched than Canada Goose, some dramatically so; calls of 'hutchinsii' more similar to Canada Goose.",,
22,Swans,Anatidae,Tundra Swan,Cygnus columbianus,132cm,"Call is a noisy, high-pitched whooping or yodeling.",,
22,Swans,Anatidae,Trumpeter Swan,Cygnus buccinator,152cm,"Common call is a single or double ""honk"" like an old car horn.",,
22,Swans,Anatidae,Whooper Swan,Cygnus cygnus,152cm,Common call is a buglelike double note.,,
22,Swans,Anatidae,Mute Swan,Cygnus olor,152cm,"Gives a variety of hisses and snorts, but generally silent.",,
24,Ducks,Anatidae,Black-bellied Whistling-Duck,Dendrocygna autumnalis,53cm,"Call is a high-pitched, four-note whistle.",,
24,Ducks,Anatidae,Fulvous Whistling-Duck,Dendrocygna bicolor,51cm,"Call is a squealing ""pe-chee"".",,
24,Ducks,Anatidae,Wood Duck,Aix sponsa,47cm,"Male gives a soft, upslurred whistle when swimming; female's squealing flight call is a rising ""oo-eek"".",,
24,Ducks,Anatidae,Muscovy Duck,Cairina moschata,66-84cm,NA,,
26,Ducks,Anatidae,Mallard,Anas platyrhynchos,58cm,"Male, a ""quack"" and rasping ""kreep""; female, a series of ""quack"" notes.",,
26,Ducks,Anatidae,Mottled Duck,Anas fulvigula,56cm,Similar to Mallard.,,
26,Ducks,Anatidae,American Black Duck,Anas rubripes,58cm,Similar to Mallard.,,
28,Ducks,Anatidae,Eastern Spot-billed Duck,Anas zonorhyncha,56cm,NA,,
28,Ducks,Anatidae,Gadwall,Anas strepera,51cm,NA,,
28,Ducks,Anatidae,Falcated Duck,Anas falcata,48cm,NA,,
28,Ducks,Anatidae,Green-winged Teal,Anas crecca,37cm,"Male, a liquid ""preep"" or ""krick""; female, a weak, high-pitched ""quack"".",,
28,Ducks,Anatidae,Baikal Teal,Anas formosa,43cm,NA,,
30,Ducks,Anatidae,American Wigeon,Anas americana,48cm,"Male gives a piercing, three-note whistle; female call is a much lower ""quack"".",,
30,Ducks,Anatidae,Eurasian Wigeon,Anas penelope,51cm,"Male gives a whistled ""wheeeeu"", like American Wigeon but with two, not three, syllables, and even higher pitched.",,
30,Ducks,Anatidae,White-cheeked Pintail,Anas bahamensis,43cm,NA,,
30,Ducks,Anatidae,Northern Pintail,Anas acuta,male: 66cm; female: 51cm,"Male gives a whistled call, similar to Green-winged Teal; female gives a single or series of ""quacks"".",,
32,Ducks,Anatidae,Northern Shoveler,Anas clypeata,48cm,"Male gives a two-syllable call; females gives a ""quack"".",,
32,Ducks,Anatidae,Blue-winged Teal,Anas discors,39cm,"Male gives a whistled ""peeu""; female gives a nasal ""quack"".",,
32,Ducks,Anatidae,Cinnamon Teal,Anas cyanoptera,41cm,"Male gives a chattering call; female gives a nasal ""quack"".",,
32,Ducks,Anatidae,Garganey,Anas querquedula,39cm,NA,,
34,Ducks,Anatidae,Canvasback,Aythya valisineria,53cm,NA,,
34,Ducks,Anatidae,Common Pochard,Aythya ferina,46cm,NA,,
34,Ducks,Anatidae,Redhead,Aythya americana,48cm,NA,,
34,Ducks,Anatidae,Ring-necked Duck,Aythya collaris,43cm,NA,,
36,Ducks,Anatidae,Tufted Duck,Aythya fuligula,43cm,NA,,
36,Ducks,Anatidae,Greater Scaup,Aythya marila,46cm,NA,,
36,Ducks,Anatidae,Lesser Scaup,Aythya affinis,42cm,NA,,
38,Ducks,Anatidae,Common Eider,Somateria mollissima,61cm,NA,,
38,Ducks,Anatidae,King Eider,Somateria spectabilis,56cm,NA,,
38,Ducks,Anatidae,Spectacled Eider,Somateria fischeri,53cm,NA,,
40,Ducks,Anatidae,Steller's Eider,Polysticta stelleri,43cm,"Usually silent, in flight wings produce a loud whistling sound.",,
40,Ducks,Anatidae,Harlequin Duck,Histrionicus histrionicus,42cm,"Male's call is a high-pitched nasal squeaking, but mostly silent, except during breeding season.",,
40,Ducks,Anatidae,Long-tailed Duck,Clangula hyemalis,56cm,"Loud, yodeling, three-part calls, heard all year.",,
42,Ducks,Anatidae,Surf Scoter,Melanitta perspicillata,51cm,"Mostly silent, except during display.",,
42,Ducks,Anatidae,Black Scoter,Melanitta americana,48cm,Most vocal of the scoters. Drakes call even in winter; most frequent call is a prolonged and plaintive whistle.,,
42,Ducks,Anatidae,Common Scoter,Melanitta nigra,48cm,Whistle note of male much shorter and higher pitched than Black.,,
42,Ducks,Anatidae,White-winged Scoter,Melanitta fusca,53cm,Mostly silent.,,
44,Ducks,Anatidae,Bufflehead,Bucephala albeola,34cm,Mostly silent. Display sounds feeble in comparison to goldeneyes.,,
44,Ducks,Anatidae,Common Goldeneye,Bucephala clangula,47cm,"Wings in flight produce a whistling sound in both species. Drakes give a raspy, high-pitched, double-note call when throwing head back in elaborate display; females of both species give a grunting note.",,
44,Ducks,Anatidae,Barrow's Goldeneye,Bucephala islandica,46cm,"In display (less elaborate than Common), drake gives an ""e-eng"" call.",,
44,Ducks,Anatidae,Smew,Mergellus albellus,41cm,NA,,
46,Ducks,Anatidae,Hooded Merganser,Lophodytes cucullatus,46cm,"Generally silent, except in display, when drake gives a rolling froglike note; female gives a single harsh note.",,
46,Ducks,Anatidae,Common Merganser,Mergus merganser,64cm,"Generally silent, except in display, when drake gives single, bell-like calls. Both sexes give single harsh calls.",,
46,Ducks,Anatidae,Red-breasted Merganser,Mergus serrator,58cm,"Generally silent, except in display, when drake gives various notes, including mewing calls; female gives various harsh calls.",,
48,Ducks,Anatidae,Ruddy Duck,Oxyura jamaicensis,38cm,"Mostly silent. During display, male produces soft ticking and popping sounds.",,
48,Ducks,Anatidae,Masked Duck,Nomonyx dominicus,34cm,NA,,
48,Ducks,Anatidae,Swan Goose,Anser cygnoides,114cm,NA,,
48,Ducks,Anatidae,Common Shelduck,Tadorna tadorna,64cm,NA,,
48,Ducks,Anatidae,Ruddy Shelduck,Tadorna ferruginea,66cm,NA,,
48,Ducks,Anatidae,Bar-headed Goose,Anser indicus,76cm,NA,,
48,Ducks,Anatidae,Mandarin Duck,Aix galericulata,41cm,NA,,
54,New World Quail,Odontophoridae,Northern Bobwhite,Colinus virgianus,25cm,"Male's song is a rising, whistled *bob-white*, heard chiefly in spring and summer and delivered from a low perch; whistled ""hoy"" call is heard year-round. Also gives soft clucking notes.",,
54,New World Quail,Odontophoridae,Montezuma Quail,Cyrtonyx montezumae,22cm,"Call given by male in breeding season is a loud, quavering, descending whistle. Female gives multisyllabic whistles on one pitch.",,
54,New World Quail,Odontophoridae,Mountain Quail,Oreortyx pictus,28cm,"Male's mating call is a loud, clear, descending ""quee-ark"", at a distance ""twoook""; both sexes give whistled notes in rapid series.",,
54,New World Quail,Odontophoridae,Gambel's Quail,Callipepla gambelii,25cm,"Territorial breeding-season call of male is a prolonged note that rises and descend. Calls include varied grunts and cackles, most differing from California; loud, querulous ""chi-ca-go-go"" call is similar to California but is higher pitched and more hesitant and usually has four notes.",,
54,New World Quail,Odontophoridae,California Quail,Callipepla californica,25cm,"Territorial breeding-season call of male is a single ""cah"" note, shorter and less descending than Gambel's territorial call. Calls include varied grunts and cackles, including a characteristic and sharp series of ""pit"" notes; loud, emphatic locatin note, ""chi-ca-go"" call is similar to Gambel's but is lower pitched and less hesitant and usually has three notes rather than four.",,
54,New World Quail,Odontophoridae,Scaled Quail,Callipepla squamata,25cm,"During breeding season, male utters a loud, single harsh note, ""squeach"". Both sexes give a location call when separated, a low, nasal ""chip-churr"", accented on the second syllable.",,
58,Chacalaca,Cracidae,Plain Chachalaca,Ortalis vetula,56cm,"Male's call is a deep, ringing ""cha-cha-lac"", often given in a loud chorus with other birds; female's voice is higher pitched. Most vocal during breeding season.",,
58,Partridges,Phasianidae,Chukar,Alectoris chukar,36cm,"Calls include a series of loud, rapid ""chuck chuck chuck"" notes and a shrill ""whitoo"" alarm note.",,
58,Partridges,Phasianidae,Gray Partridge,Perdix perdix,32cm,"Calls include a hoarse ""kee-uck"", likened to a rusty gate.",,
60,Partridges,Phasianidae,Ring-necked Pheasant,Phasianus colchicus,male: 84cm; female: 53cm,"Male's territorial call is a loud, penetrating ""kok-cack"". Both sexes give hoarse, croaking alarm notes. When flushed, rises almost vertically with a loud whirring of wings.",,
60,Partridges,Phasianidae,Himalayan Snowcock,Teraogallus himalayensis,71cm,"Calls include various clucks and cackles while feeding. One advertising call suggestive of Long-billed Curlew, male's call rises, female's descends.",,
60,Partridges,Phasianidae,Wild Turkey,Meleagris gallopavo,male: 117cm; female: 94cm,In spring a male's gobbling call may be heard a mile away.,,
62,Partridges,Phasianidae,Ruffed Grouse,Bonasa umbellus,43cm,"In spring, male displays by raising ruff and crest, fanning tail, and beating wings to make a hollow, accelerating, drumming noise. Both sexes give soft clucking notes. Often displays from a fallen log.",,
62,Partridges,Phasianidae,Spruce Grouse,Falcipenis canadensis,41cm,"Both sexes give soft clucking notes. In courtship display, male spreads tail, erects red eye combs, rapidly beats wings. In territorial flight display, male flutters upward on shallow wingstrokes; Franklin's ends this performance by beating wings together, making a clapping sound. Female's high-pitched call is thought to be territorial.",,
62,Partridges,Phasianidae,Dusky Grouse,Dendragapus obscurus,51cm,"Male's display call, usually given from ground, softer and lower pitched than Sooty and audible only at close range.",,
62,Partridges,Phasianidae,Sooty Grouse,Dendragapus fuliginosus,51cm,"Male's display call is a seris of loud low hoots audible at considerable distance, usually given from perch in tree. More southerly ssp. mostly conceal air sacs when hooting (more research needed).",,
64,Partridges,Phasianidae,White-tailed Ptarmigan,Lagopus leucura,32cm,"Calls include a henlike clucking and soft, low hoots.",,
64,Partridges,Phasianidae,Willow Ptarmigan,Lagopus lagopus,38cm,"Calls include low growls and croaks, noisy cackles. In courtship and territorial displays,male utters a raucous *go-back go-back go-backa go-backa go-backa*.",,
64,Partridges,Phasianidae,Rock Ptarmigan,Lagopus muta,36cm,Calls include low growls and croaks and noisy cackles.,,
66,Partridges,Phasianidae,Greater Prairie-Chicken,Tympanuchus cupido,43cm,"Courting males make a deep ""oo-loo-woo"" sound known as 'booming', like blowing over top of an empty bottle.",,
66,Partridges,Phasianidae,Lesser Prairie-Chicken,Tympanuchus pallidicinctus,41cm,Male's courtship notes are higher pitched than Greater.,,
66,Partridges,Phasianidae,Sharp-tailed Grouse,Tympanuchus phasianellus,43cm,"Male's courting notes include cackling and a single, low ""coo-oo"" call accompanied by the rattling of wing quills.",,
66,Partridges,Phasianidae,Gunnison Sage-Grouse,Centrocercus minimus,male: 56cm; female: 46cm,"Male's display call lower pitched, more uniform than Greater.",,
66,Partridges,Phasianidae,Greater Sage-Grouse,Centrocercus urophasianus,male: 71cm; female: 56cm,"In display, male rapidly inflates and deflates air sacs, emitting a loud, bubbling popping.",,
68,Grebes,Podicipedidae,Least Grebe,Tachybaptus dominicus,25cm,"Gives nasal ""beep""; in display, a rapid, buzzy trill.",,
68,Grebes,Podicipedidae,Pied-billed Grebe,Podilymbus podiceps,34cm,"On breeding grounds, delivers a loud series of gulping notes. Also gives an electric ""huzza-huzza-huzza-huzza"".",,
68,Grebes,Podicipedidae,Horned Grebe,Podiceps auritus,34cm,"Mostly silent, except on nesting grounds.",,
68,Grebes,Podicipedidae,Eared Grebe,Podiceps nigricollis,32cm,"Most vocal on breeding grounds; most frequent call is a rising whistled note. Old World birds give very different vocalizations, likely a separate species (Black-necked Grebe).",,
70,Grebes,Podicipedidae,Red-necked Grebe,Podiceps grisegena,51cm,"Calls, usually heard only on breeding grounds, include a ""crick-crick"" note and drawn-out braying calls.",,
70,Grebes,Podicipedidae,Western Grebe,Aechmophorus occidentalis,4cm,"Call is a loud, two-note ""crick-kreek"".",,
70,Grebes,Podicipedidae,Clark's Grebe,Aechmophorus clarkii,64cm,"Call is a single, drawn-out ""kreeeek"" note.",,
70,Flamingos,Phoenicopteridae,American Flamingo,Phoenicopterus ruber,117cm (length); 152cm (wingspan),Mostly silent; occasional honking notes.,,
72,Pigeons/Doves,Columbidae,Band-tailed Pigeon,Patagioenas fasciata,37cm,"Song is a deep, owl-like ""whoo-whooo""; grating call given in display flight.",,
72,Pigeons/Doves,Columbidae,Rock Pigeon,Columba livia,32cm,"Song is a soft ""coo-cuk-cuk-cuk-coooo"".",,
72,Pigeons/Doves,Columbidae,White-crowned Pigeon,Patagioenas leucocephala,34cm,"Songs include a loud, deep ""coo-cura-cooo"" or ""coo-croo"".",,
72,Pigeons/Doves,Columbidae,Red-billed Pigeon,Patagioeas flavirostris,37cm,"Distinctive song heard in early spring and summer, a long, high-pitched ""cooooo"" followed by four loud ""up-cup-a-coo"" notes.",,
74,Pigeons/Doves,Columbidae,Oriental Turtle-Dove,Streptopelia orientalis,34cm,NA,,
74,Pigeons/Doves,Columbidae,Eurasian Collared-Dove,Streptopelia decaocto,32cm,"Three-syllable song, ""coo-coo-cup"", is given year-round; also a loud, downslurred mewing call in display flight; most similar Ringed Turtle-Doves give a two-syllable call, the second rough and drawn-out.",,
74,Pigeons/Doves,Columbidae,Spotted Dove,Streptopelia chinensis,30cm,"Song is a rather harsh ""coo-coo-croooo"" and ""co-crrooo-coo"", with emphasis respectively on the last and middle notes.",,
74,Pigeons/Doves,Columbidae,Inca Dove,Columbina inca,21cm,"Song is a double ""cooo-coo"", often phrased as ""no-hope"". In flight, wings make a rattling sound.",,
76,Pigeons/Doves,Columbidae,Common Ground-Dove,Columbina passerina,17cm,"Song is a repeated soft, ascending ""wah-up"".",,
76,Pigeons/Doves,Columbidae,Ruddy Ground-Dove,Columbina talpacoti,17cm,Song like Common but faster and a little lower in pitch.,,
76,Pigeons/Doves,Columbidae,Ruddy Quail-Dove,Geotrygon montana,25cm,"N.A. strays have been silent. Song from a perch a series of very deep, resonant, monosyllabic ""coo"" notes, repeated every three to four seconds and slightly trailing off at end.",,
76,Pigeons/Doves,Columbidae,Key West Quail-Dove,Geotrygon chrysia,30cm,"Song is a long, cooing note given from a perch in a tree. Recent N.A. birds have not been heard vocalizing.",,
78,Pigeons/Doves,Columbidae,White-tipped Dove,Leptotila verreauxi,29cm,Low-pitched song is like the sound produced by blowing across the top of a bottle. Wings give a high twittering sound in flight.,,
78,Pigeons/Doves,Columbidae,White-winged Dove,Zenaida asiatica,29cm,"Song, a drawn-out, cooing *who-cooks-for-you*, has many variations and is heard during the breeding season.",,
78,Pigeons/Doves,Columbidae,Zenaida Dove,Zenaida aurita,25cm,Song is similar to Mourning Dove but faster.,,
78,Pigeons/Doves,Columbidae,Mourning Dove,Zanaida macroura,30cm,"Song is a mournful ""oowoo-woo-woo-woo"". Wings produce a fluttering whistle as the bird takes flight.",,
80,Cuckoos/Roadrunners,Cuculidae,Mangrove Cuckoo,Coccyzus minor,30cm,"Call is a slow, guttural ""gaw gaw gaw"".",,
80,Cuckoos/Roadrunners,Cuculidae,Yellow-billed Cuckoo,Coccyzus americanus,30cm,"One song sounds hollow and wodden, a rapid staccato ""kuk-kuk-kuk"" that usually slows and descends to a ""kakakowlp-kowlp"" ending. Also a series of ""coo"" notes and a slowly repeated single ""keep"".",,
80,Cuckoos/Roadrunners,Cuculidae,Black-billed Cuckoo,Coccyzus eryhropthalmus,30cm,"Song usually consists of monotonous ""cu-cu-cu"" or ""cu-cu-cu-cu"" phrases.",,
80,Cuckoos/Roadrunners,Cuculidae,Greater Roadrunner,Geococcyx californianus,58cm,"Song is a dovelike series of notes, descending in pitch.",,
82,Cuckoos/Roadrunners,Cuculidae,Common Cuckoo,Cuculus canorus,33cm,"Male's song is the familiar ""cuc-coo"" for which the family is named but is rarely heard in N.A.",,
82,Cuckoos/Roadrunners,Cuculidae,Oriental Cuckoo,Cuculus optatus,32cm,"Song a variable, hollow note often delivered by series of hoots, then series of paired notes (""hoo-hoo""); has not been heard in N.A.",,
82,Cuckoos/Roadrunners,Cuculidae,Groove-billed Ani,Crotophaga sulcirostris,34cm,"Call is a liquid ""tee-ho"", accented on the first syllable.",,
82,Cuckoos/Roadrunners,Cuculidae,Smooth-billed Ani,Crotophaga ani,37cm,"Call is a whining, rising ""quee-lick"".",,
84,Goatsuckers,Caprimulgidae,Lesser Nighthawk,Chordeiles acutipennis,22cm,"Call a rapid, tremulous trill, heard only on breeding grounds.",,
84,Goatsuckers,Caprimulgidae,Common Nighthawk,Chordeiles minor,24cm,"In courtship display, mae's wings make a hollow booming sound. Nasal ""peent"" call, given even in migration, is diagnostic.",,
84,Goatsuckers,Caprimulgidae,Antillean Nighthawk,Chordeiles gundlachii,20cm,"Call is a varying ""pity-pit-pit"".",,
84,Goatsuckers,Caprimulgidae,Common Pauraque,Nyctidromus albicollis,28cm,"Distinctive song is one or more low ""pur"" notes followed by a higher, descending ""wheeer"".",,
86,Goatsuckers,Caprimulgidae,Chuck-will's window,Antrostomus carolinensis,30cm,"Loud, whistling song sounds like *chuck-will's-widow*.",,
86,Goatsuckers,Caprimulgidae,Eastern Whip-poor-will,Antrostomus vociferus,25cm,"A clear, loud *whip-poor-will*. Also ""cluck"" notes, especially in flight.",,
86,Goatsuckers,Caprimulgidae,Mexican Whip-poor-will,Antrostomus arizonae,25cm,"Like Eastern, but *whip-poor-will* song much burrier; also gives ""cluck"" notes in flight.",,
86,Goatsuckers,Caprimulgidae,Buff-collared Nightjar,Antrostomus ridgwayi,22cm,"Song, an accelerating series of ""cuk"" notes ending with ""cukacheea"".",,
86,Goatsuckers,Caprimulgidae,Common Poorwill,Phalaenoptilus nuttallii,20cm,"Song is a whistled *poor-will*, with a final ""ip"" note audible at close range.",,
88,Swifts,Apodidae,Black Swift,Cypseloides niger,18cm,"Series of ""chick"" calls, delivered more slowly than Chimney.",,
88,Swifts,Apodidae,White-throated Swift,Aeronautes saxatalis,17cm,"Call is a loud, descending harsh chatter.",,
88,Swifts,Apodidae,Vaux's Swift,Chaetura vauxi,12cm,"Call softer, higher, and more insectlike than Chimney Swift.",,
88,Swifts,Apodidae,Chimney Swift,Chaetura pelagica,13cm,"Chattering call louder, lower-pitched than Vaux's Swift.",,
90,Swifts,Apodidae,White-collared Swift,Streptoprocne zonaris,22cm,NA,,
90,Swifts,Apodidae,White-throated Needletail,Hirundapus caudacutus,20cm,NA,,
90,Swifts,Apodidae,Common Swift,Apus apus,17cm,NA,,
90,Swifts,Apodidae,Fork-tailed Swift,Apus pacificus,20cm,NA,,
92,Hummingbirds,Trochilidae,Mexican Violetear,Colibri thalassinus,11cm,"Sog a repeated, often incessant ""tsip tsup"" with other notes mixed in; often given from a perch.",,
92,Hummingbirds,Trochilidae,Green-breasted Mango,Anthracothorax prevostii,12cm,"Usually silent. Gives hard ticking chip notes, often in a series of higher ""sip"" calls in flight.",,
92,Hummingbirds,Trochilidae,Lucifer Hummingbird,Calothorax lucifer,10cm,"Call a hard, rich ""chih"", sometimes doubled; rapid series of notes in chases.",,
94,Hummingbirds,Trochilidae,Magnificent Hummingbird,Eugenes fulgens,13cm,"Call a sharp ""chip""; gives other squeaky notes.",,
94,Hummingbirds,Trochilidae,Blue-throated Hummingbird,Lampornis clemenciae,13cm,"Call a loud, high, repeated ""seep"". Song of male given from a perch is a long, continuous series of ""seep"" notes.",,
94,Hummingbirds,Trochilidae,Plain-capped Starthroat,Heliomaster constantii,13cm,"Call a sharp ""chip"", reminiscent of Black Phoebe. Male's song delivered from a conspicuous perch, a series of sharp ""chip"" notes with other notes interspersed.",,
96,Hummingbirds,Trochilidae,Ruby-throated Hummingbird,Archilochus colubris,9cm,"Call a soft ""tchew""; sometimes mixed with squeals in chases. Adult males give a soft wing hum.",,
96,Hummingbirds,Trochilidae,Black-chinned Hummingbird,Archilochus alexandri,9cm,"All calls like Ruby-throated, including the soft ""tchew"".",,
96,Hummingbirds,Trochilidae,Costa's Hummingbird,Calypte costae,8cm,"Call is a high-pitched metallic ""tink"", often given in a series. Male's call is a loud ""zing"" usually heard during circular flight display.",,
98,Hummingbirds,Trochilidae,Anna's Hummingbird,Calypte ana,10cm,"Common call note a sharp ""chick""; chase call a rapid, dry rattling. Male's song a jumble of high squeaks and raspy notes. Male rises slowly in display and then dives steeply giving a sharp ""tweek"" (produced by outermost tail feather) at bottom and rising again for repeat performance.",,
98,Hummingbirds,Trochilidae,Broad-billed Hummingbird,Cynanthus latirostris,10cm,"Chattering ""je-dit"" call is similar to Ruby-crowned Kinglet. Male's display call is a whining ""zing"".",,
98,Hummingbirds,Trochilidae,White-eared Hummingbird,Hylocharis leucotis,10cm,"Chattering calls are loud and metallic. Male's display call a repeated, silvery ""tink tink tink"".",,
100,Hummingbirds,Trochilidae,Bahama Woodstar,Calliphlox evelynae,9cm,Calls suggestive of Anna's Hummingbird.,,
100,Hummingbirds,Trochilidae,Calliope Hummingbird,Selasphorus calliope,8cm,"Relatively silent. Gives soft, high-pitched, metallic ""chip"" notes. Adult males produce buzzy ""bzzt"" calls in display dives.",,
100,Hummingbirds,Trochilidae,Broad-tailed Hummingbird,Selasphorus platycercus,10cm,"Except during winter molt, adult male's modified outer primary tips produce a loud, cricketlike trill in flight. Calls include a metallic ""chip"", different from Rufous and Allen's.",,
102,Hummingbirds,Trochilidae,Rufous Hummingbird,Selasphorus rufus,9cm,"Buzzy wing trill of adult male and all calls essentially identical to Allen's. Calls include a ""chip"", often given in a series (less metallic than Broad-tailed); chase note, ""zeee-chuppity-chup"", is a constant sound around feeders where Rufous or Allen's dominates.",,
102,Hummingbirds,Trochilidae,Allen's Hummingbird,Selasphorus sasin,10cm,All call notes and adult male wing buzz similar to Rufous.,,
104,Hummingbirds,Trochilidae,Berylline Hummingbird,Amazilia beryllina,10cm,"Hard buzzy ""dzzrit"". Song of male is a squeaky complex warbling with chip notes.",,
104,Hummingbirds,Trochilidae,Buff-bellied Hummingbird,Amazilia yucatanensis,10cm,"Gives a sharp ""tschick"" as well as other shrill and squeaky notes.",,
104,Hummingbirds,Trochilidae,Violet-crowned Hummingbird,Amazilia violiceps,11cm,"Call a loud, squeaky chattering; male's song a series of sibilant ""ts"" notes.",,
104,Limpkin,Aramidae,Limpkin,Aramus guarauna,66cm,"Call, heard chiefly at night, is a wailing ""krr-oww"".",,
106,Rails,Rallidae,Yellow Rail,Coturnicops noveboracensis,18cm,"Distinctive call, heard chiefly in breeding season, is a four- or five-note ""tick-tick, tick-tick-tick"" in alternate twos or twos and threes, sounds like tapping two pebbles together.",,
106,Rails,Rallidae,Black Rail,Laterallus jamaicensis,15cm,"Most vocal in the middle of the night. Distinctive song heard chiefly in breeding season, is a repeated ""kik-kee-do"" or ""kik-kee-derr""; sometimes four notes: ""kik-kik-kee-do"". Also gives a fast sputtering trill and growling notes.",,
106,Rails,Rallidae,Sora,Porzana carolina,22cm,"Calls heard year-round are a descending whinny and a sharp high-pitched ""keek""; a whistled ""ker-wheer"" is heard mainly on breeding grounds.",,
106,Rails,Rallidae,Corn Crake,Crex crex,27cm,NA,,
108,Rails,Rallidae,Ridgway's Rail,Rallus obsoletus,39cm,"Presumably like Clapper, but no comparative studies.",,
108,Rails,Rallidae,Clapper Rail,Rallus crepitans,37cm,"Call is a series of 10 or more dry ""kek kek kek"" notes, like King but accelerating and then slowing. Some calls are nearly identical to King.",,
108,Rails,Rallidae,King Rail,Rallus elegans,38cm,"As wih Clapper, most often heard at dusk and dawn. Usually distinctive call is a series of fewer than 10 ""kek kek kek"" notes, fairly evenly spaced; tempo slower than Clapper. Also a series of grunting notes.",,
108,Rails,Rallidae,Virginia Rail,Rallus limicola,24cm,"Song is a series of ""kik kik kidick kidick"" phrases, also a ""tic tic turrr""; heard chiefly in breeding season; common call, heard year-round, is a descending series of ""oink"" notes.",,
110,Rails,Rallidae,Purple Gallinule,Porphyrio martinicus,33cm,"Call is a sharp ""kek""; also a series of grunting notes.",,
110,Rails,Rallidae,Purple Swamphen,Porphyrio porphyrio,46-51cm,Gives a wide variety of nasal and cackling calls.,,
