Page,Section,Family,EnglishCommon,LatinSpecies,Length,Voice,,
398,Sylviid Warblers,Sylviidae,Wrentit,Chamaea fasciata,17cm,"Usually heard before seen. Male's loud song, sung year-round, begins with a series of accelerating notes and runs into a descending trill: ""pit-pit-pit-r-r-r"". Female's song lacks trill. Both sexes give soft, low ""prr"" note, often in a series.",,
400,Leaf Warblers,Phylloscopidae,Willow Warbler,Phylloscopus trochilus,11cm,"Whistled ""hoo-eet"" call note is very unlike Arctic's buzzy note.",,
400,Leaf Warblers,Phylloscopidae,Common Chiffchaff,Phylloscopus collybita,11cm,"Birds seen in N.A. have been silent; calls are geographically variable, ""tristis"" gives an even ""hip"".",,
400,Leaf Warblers,Phylloscopidae,Arctic Warbler,Phylloscopus borealis,13cm,"Song is a long series of toneless buzzy notes. Call is a buzzy single-syllable ""dzik"".",,
400,Leaf Warblers,Phylloscopidae,Kachatka Leaf Warbler,Phylloscopus examinandus,13cm,"Often silent; call note distinctive: a two-syllable ""tzz-eet"".",,
400,Leaf Warblers,Phylloscopidae,Dusky Warbler,Phylloscopus fuscatus,14cm,"Call, a hard, sharp ""tschick"", suggests Lincoln's Sparrow.",,
402,Leaf Warblers,Phylloscopidae,Wood Warbler,Phylloscopus sibilatrix,13cm,NA,,
402,Leaf Warblers,Phylloscopidae,Pallas's Leaf Warbler,Phylloscopus proregulus,9cm,"Call is a soft, nasal rising ""chuee"".",,
402,Leaf Warblers,Phylloscopidae,Yellow-browed Warbler,Phylloscopus inornatus,11cm,"Call, upslurred ""swee-eet"", suggests male Pacific-slope Flycatcher.",,
402,Grasshopper-Warblers,Locustellidae,Middendorff's Grasshopper-Warbler,Locustella ochotensis,15cm,NA,,
402,Grasshopper-Warblers,Locustellidae,Lanceolated Warbler,Locustella lanceolata,11cm,"Distinctive call, a metallic ""rink-tink-tink"", delivered infrequently; also an excited ""chack"". Song, a thin, reeling sound, like a fishing line.",,
404,Old World Flycatchers and Chats,Muscicapidae,Narcissus Flycatcher,Ficedula narcissina,13cm,NA,,
404,Old World Flycatchers and Chats,Muscicapidae,Taiga Flycatcher,Ficedulla albicilla,13cm,"Gives rattled ""trrt"" call; also a metallic ""tic"" and harsh ""ze-it"".",,
404,Old World Flycatchers and Chats,Muscicapidae,Dark-sided Flycatcher,Muscicapa sibirica,13cm,NA,,
404,Old World Flycatchers and Chats,Muscicapidae,Asian Brown Flycatcher,Muscicapa dauurica,13cm,NA,,
404,Old World Flycatchers and Chats,Muscicapidae,Gray-streak Flycatcher,Muscicapa griseisticta,15cm,NA,,
406,Old World Flycatchers and Chats,Muscicapidae,Siberian Rubythroat,Luscinia calliope,15cm,"Calls include a deep, low ""chuck"" and a loud, whistled ""quee-ah""; song, long and complex, includes warbles and lisping notes.",,
406,Old World Flycatchers and Chats,Muscicapidae,Bluethroat,Luscinia sbecica,14cm,"In courthip, males sing from high perches and in elaborate display flight. Varied, melodious often begins with a crisp, metallic ""ting ting ting""; call, ""tchak"", often given in a series; mimics other species.",,
406,Old World Flycatchers and Chats,Muscicapidae,Red-flanked Bluetail,Tarsiger cyanurus,14cm,"Calls include a ""hueet"" and dry ""keck-keck"".",,
406,Old World Flycatchers and Chats,Muscicapidae,Nothern Wheatear,Oenanthe oenanthe,15cm,"Calls include ""chak"" and whistled ""wheet"". Song, a scratchy warbling mixed with call notes, often given in flight with tail spread.",,
406,Old World Flycatchers and Chats,Muscicapidae,Stonechat,Saxicola torquatus,13cm,NA,,
408,Thrushes,Turdidae,Eastern Bluebird,Sialia sialis,18cm,"Call note is a musical, rising ""chur-lee"", extended in song to ""chur chur-lee chur-lee"".",,
408,Thrushes,Turdidae,Western Bluebird,Sialia mexicana,18cm,"Call note a mellow ""few"", given in a brief series for song.",,
408,Thrushes,Turdidae,Mountain Bluebird,Sialia currucoides,18cm,"Call is a thin ""veew""; song, a low, warbled ""tru-lee"".",,
408,Thrushes,Turdidae,Townsend's Solitaire,Myadestes townsendi,22cm,"Call note is a high-pitched ""eek""; song, heard all year, is a loud, complex, melodious warbling.",,
410,Thrushes,Turdidae,Gray-cheeked Thrush,Catharus minimus,18cm,"Thin, nasal song is somewhat like Veery, but first and last phrases drop, middle one rises; call is a sharp ""pheu"", similar to Veery, but higher pitched and not descending.",,
410,Thrushes,Turdidae,Bicknell's Thrush,Catharus bicknelli,16cm,"Song usually comes in three parts, the first and last rising; call like Gray-cheeked but higher pitched.",,
410,Thrushes,Turdidae,Veery,Catharus fuscescens,18cm,"Song is a descending series of ""veer"" notes; call is a sharp, descending, whistled ""veer"" or ""phew"".",,
410,Thrushes,Turdidae,Swainson's Thrush,Catharus ustulatus,18cm,"Song, an ascending spiral of whistles; call is a liquid ""whit"" in Pacific coast ssp. a sharper ""quirk"" in others; a night a peeping ""qeep"".",,
410,Thrushes,Turdidae,Hermit Thrush,Catharus guttatus,17cm,"Song is a serene series of clear, flutelike notes, the similar phrases repeated at different pitches. Calls include a deeper ""chuck"" (geographically variable), often doubled, and a whiny, upslurred ""wee"".",,
412,Thrushes,Turdidae,Wood Thrush,Hylocichla mustelina,20cm,"Loud, liquid song of three- to five-note phrases, each phrases usually ending with a complex trill. Calls include a rapid ""pit pit pit"".",,
412,Thrushes,Turdidae,Eyebrowed Thrush,Turdus obscurus,22cm,"Flight call is a high, piercing, drawn-out ""dzee"".",,
412,Thrushes,Turdidae,Dusky Thrush,Turdus naumanni,24cm,"Call is a series of ""shack"" notes; also a shrill, wheezy ""shree"".",,
412,Thrushes,Turdidae,Fieldfare,Turdus pilaris,25cm,"Song is a noisy twittering; call note is a series of ""shack"" notes, like Dusky Thrush; also gives a thin ""seeh"".",,
412,Thrushes,Turdidae,Redwing,Turdus iliacus,21cm,"Call is a thin, penetrating ""seeeh"", usually heard in flight; also a hard ""kuk"" note.",,
414,Thrushes,Turdidae,American Robin,Turdus migratorius,25cm,"Loud, liquid song, is a variable *cheerily cheer-up cheerio*. Calls include a rapid ""tut tut tut""; a high, thin ""ssip"" in flight.",,
414,Thrushes,Turdidae,Rufous-backed Robin,Turdus rufopalliatus,23cm,"Calls include a plaintive, drawn-out, whistled ""teeeuu"", a clucking series of ""chuk"" notes, and in flight, a high, thin ""ssi"".",,
414,Thrushes,Turdidae,Clay-colored Thrush,Turdus grayi,24cm,"Calls include a slurred ""reeeur-ee"", a clucking note, and, in flight, a high, thin ""ssi""; song resembles American Robin but is slower, clearer.",,
414,Thrushes,Turdidae,White-throated Thrush,Turdus assimilis,24cm,"Call is a nasal ""rreeuh"", often doubled.",,
414,Thrushes,Turdidae,Aztec Thrush,Ridgwayia pinicola,23cm,"Calls are quavering ""wheeerr"", a metallic ""wheer"", and a clear ""sweee-uh"".",,
416,Thrushes,Turdidae,Varied Thrush,Ixoreus naevius,24cm,"Call is a soft, low ""tschook""; song is a slow series of variously pitched, drawn-out buzzy notes.",,
416,Mockingbirds/Thrashers,Mimidae,Gray Catbird,Dumetella carolinensis,22cm,"Song is a mixture of melodious, nasal, and squeaky notes interspersed with catlike ""mew"" notes; some are good mimics. Most readily identified by harsh, downslurred ""mew"" call; also gives a low ""quirt"" and a clucking noise.",,
416,Mockingbirds/Thrashers,Mimidae,Blue Mockingbird,Melanotis caerulescens,25cm,Song and call notes vary widely.,,
416,Mockingbirds/Thrashers,Mimidae,Northern Mockingbird,Mimus polyglottos,25cm,"Song is a mixture of original and imitative (other species) phrases, each repeated several times. Often sings at night. Both sexes sing in fall, claiming feeding territories. Call is a loud, sharp ""check"".",,
416,Mockingbirds/Thrashers,Mimidae,Bahama Mockingbird,Mimus gundlachii,28cm,"Song is varied but not known to include imitations; call slightly harsher, more downslurred than Northern.",,
418,Mockingbirds/Thrashers,Mimidae,Brown Thrasher,Toxostoma rufum,29cm,"Sings a series of varied melodious phrases, each phrase usually given only two or three times. Seldom imitates other birds. Calls include a sharp ""spuck"" and a low ""churr"".",,
418,Mockingbirds/Thrashers,Mimidae,Long-billed Thrasher,Toxostoma longirostre,29cm,"Song similar to Brown Thrasher. Gives ""tsuck"" call like Brown; other calls, a mellow ""kleak"", and a loud, whistled ""cheeooep"".",,
418,Mockingbirds/Thrashers,Mimidae,Sage Thrasher,Oreoscoptes montanus,22cm,"Song is a long series of warbled phrases. Calls include a ""chuck"" and a high ""churr"", but often silent.",,
418,Mockingbirds/Thrashers,Mimidae,California Thrasher,Toxostoma redivivum,30cm,"Calls are a low, flat ""chuck"" and ""chur-erp"". Song is loud and sustained, with mostly guttural phrases, often repeated once or twice. Imitates other species and sounds.",,
420,Mockingbirds/Thrashers,Mimidae,Curve-billed Thrasher,Toxostoma curvirostre,28cm,"Distinctive call a sharp upslurred ""whit-wheet"", sometimes three-noted (palmeri); even-pitched ""whit-whit"" (oberholseri and curvirostre). Song is elaborate and melodic, and includes low trills and warbles.",,
420,Mockingbirds/Thrashers,Mimidae,Bendire's Thrasher,Toxostoma bendirei,25cm,"Song is a sustained, melodic warbling, each phrase repeated one to three times. Low ""chuck"" all is seldom heard.",,
420,Mockingbirds/Thrashers,Mimidae,Le Conte's Thrasher,Toxostoma lecontei,28cm,"Melodious song, heard chiefly at dawn and dusk. Calls include an ascending, whistled ""tweeeep"", often delivered from a bush.",,
420,Mockingbirds/Thrashers,Mimidae,Crissal Thrasher,Toxostoma crissale,29cm,"Song is varied and musical. Calls include a repeated ""chideery"" and a whistled, even-pitched ""toit-toit-toit"".",,
422,Bulbul,Pycnonotidae,Red-whiskered Bulbul,Pycnonotus jocosus,18cm,"Characteristic call is a rich, musical ""wi-ti-wheet""; also other chattering calls.",,
422,Starlings,Sturnidae,Common Myna,Acridotheres tristis,25cm,"Calls include gurglings, whistles, and screeches.",,
422,Starlings,Sturnidae,Hill Myna,Gracula religiosa,27cm,"Call is a loud, piercing two-note whistle, ""ti-ong"". An excellent mimic, and captive birds can be fine talkers.",,
422,Starlings,Sturnidae,European Starling,Sturnus vulgaris,22cm,"Song includes squeaks, warbles, chirps; imitates songs of other species. Often silent, though gives various harsh calls in interactions with others and has a soft, breezy flight call.",,
424,Waxwings,Bombycillidae,Bohemian Waxwing,Bombycilla garrulus,21cm,"Distinctive call, a buzzy twittering, lower and harsher than Cedar.",means Cedar Waxwing here,
424,Waxwings,Bombycillidae,Cedar Waxwing,Bombycilla cedrorum,18cm,"Call is a soft, high-pitched, trilled whistle.",,
424,Silky-Flycatchers,Ptiliogonatidae,Phainopepla,Phainopepla nitens,20cm,"Distinctive call is a low-pitched, whistled, querulous ""wurp?"". Song is a brief warble, seldom heard.",,
426,Oliver Warbler,Peucedramidae,Olive Warbler,Peucedramus taeniatus,13cm,"Typical song is a loud ""peeta peeta peeta"", similar to Tufted Titmouse; distinctive call is a soft, whistled ""phew"", also a hard ""pit"".",,
426,Accentors,Prunellidae,Siberian Accentor,Prunella montanella,14cm,"Call is a high, thin series of ""see"" notes.",,
426,Indigobirds and Whydahs,Viduidae,Pin-tailed Whydah,Vidua macroura,10cm,"Song a repetitive, measured and somewat jerky ""tseet tseet tsu-weet"". Call a soft ""chwit""; begging juveniles give rapid series of chip notes.",,
426,Weavers,Ploceidae,Northern Red Bishop,Euplectes franciscanus,10cm,"Song high, buzzy. Call a sharp ""tsip"" and ""tsik tsik tsik"".",,
428,Estrildid Finches,Estrildidae,Tricolored Munia,Lonchura malacca,12cm,"Gives ""tcht tcht"" contact notes; high-pitched song.",,
428,Estrildid Finches,Estrildidae,Scaly-breasted Munia,Lonchura punctulata,11cm,"Song, ""tiks"" and whistles, is nearly inaudible; call is a loud ""kibee"".",,
428,Estrildid Finches,Estrildidae,Bronze Mannikin,Spermestes cucullata,9cm,"Call is a buzzy, high-pitched ""jik"" or ""jik jik"". Song rather deep, slow, and measured and in two parts.",,
428,OldWorld Sparrows,Passeridae,Eurasian Tree-Sparrow,Passer montanus,15cm,Similar to House Sparrow but harder.,,
428,OldWorld Sparrows,Passeridae,House Sparrow,Passer domesticus,16cm,"Calls include a sweet ""cheelip"" and monotonous chirps.",,
430,Wagtails/Pipits,Motacillidae,Eastern Yellow Wagtail,Motacilla tschutschensis,17cm,"Song is a rapid series of buzzy notes on one pitch. Call is a loud buzzy ""tsweep"", similar to Eastern Kingbird.",,
430,Wagtails/Pipits,Motacillidae,Gray Wagtail,Motacilla cinerea,20cm,"Call is a metallic ""chink-chink"", higher and sharper than White.",means White Wagtail here,
430,Wagtails/Pipits,Motacillidae,White Wagtail,Motacilla alba,18cm,"Calls include a two-note ""chizzik"" given in flight and a whistled ""chee-wee"" given from perch.",,
432,Wagtails/Pipits,Motacillidae,American Pipit,Anthus rubescens,17cm,"Flight call a sharp ""pip-pit""; japonicus possibly thinner; song, a rapid series of ""cheedle"" notes given in flight on breeding grounds.",,
432,Wagtails/Pipits,Motacillidae,Sprague's Pipit,Anthus spragueii,17cm,"Call is a loud, squeaky ""squeet"", usually repeated. Song, given continuously in high flight, is a descending series of musical ""tzee-a"" notes.",,
432,Wagtails/Pipits,Motacillidae,Olive-backed Pipit,Anthus hodgsoni,15cm,"Call is a buzzy ""tsee"".",,
432,Wagtails/Pipits,Motacillidae,Pechora Pipit,Anthus gustavi,14cm,"Call is a hard, buzzy ""pwit"" or ""pit""; often silent when flushed.",,
432,Wagtails/Pipits,Motacillidae,Red-throated Pipit,Anthus cervinus,15cm,"Call, given in flight, is a high, piercing ""tseee"", dropping in pitch. Loud, varied song is delivered from the ground or in song flight.",,
434,Fringilline and Curdueline Finches/Allies,Fringillidae,Common Chaffinch,Fringilla coelebs,15cm,"Call is a metallic ""pink-pink""; also a ""hweet"".",,
434,Fringilline and Curdueline Finches/Allies,Fringillidae,Brambling,Fringilla montifringilla,16cm,"Flight call is a nasal ""check-check-check""; also gives a nasal ""zwee"". Song consists of just a short buzzy note.",,
434,Fringilline and Curdueline Finches/Allies,Fringillidae,Eurasian Bullfinch,Pyrrhula pyrrhula,17cm,"Call is a soft, piping ""pheew"".",,
434,Fringilline and Curdueline Finches/Allies,Fringillidae,Pine Grosbeak,Pinicola enucleator,23cm,"Typical flight call is a whistled ""pui pui pui""; alarm call is a musical ""chee-vli"". Location call shows considerable geographic variation. Song is a rather short, musical warble.",,
436,Fringilline and Curdueline Finches/Allies,Fringillidae,Gray-crowned Rosy-Finch,Leucosticte tephrocotis,14-21cm,"Call, a high, chirping ""chew"", is often given in courtship flight and in unison when flocks take flight, which is frequent.",,
436,Fringilline and Curdueline Finches/Allies,Fringillidae,Brown-capped Rosy-Finch,Leucosticte australis,15cm,Call similar to Gray-crowned Rosy-Finch.,,
436,Fringilline and Curdueline Finches/Allies,Fringillidae,Black Rosy-Finch,Leucosticte atrata,15cm,Call similar to Gray-crowned Rosy-Finch.,,
438,Fringilline and Curdueline Finches/Allies,Fringillidae,Purple Finch,Haemorhous purpureus,15cm,"Calls include a musical ""chur-lee"" and in flight, a sharp ""pit"", a bit sharper in californicus. Song is a rich warbling, longer and move variable in purpureus; shorter than Cassin's.",,
438,Fringilline and Curdueline Finches/Allies,Fringillidae,Cassin's Finch,Haemorhous cassinii,16cm,"Call a dry ""tee-dee-yip"". Lively variable warbling song, longer, more fluty, and more complex than Purple Finch, especially californicus.",,
438,Fringilline and Curdueline Finches/Allies,Fringillidae,House Finch,Haemorhous mexicanus,15cm,"Lively, high-pitched song consists chiefly of varied three-note phrases; includes strident notes, unlike Purple Finch's song; usually ends with a nasal ""wheer"". Calls include a whistled ""wheat"".",,
438,Fringilline and Curdueline Finches/Allies,Fringillidae,Common Rosefinch,Carpodacus erythrinus,15cm,"Call is a soft, nasal ""djuee"".",,
440,Fringilline and Curdueline Finches/Allies,Fringillidae,Red Crossbill,Loxia curvirostra,14-20cm,"Calls, given chiefly in flight, vary among ssp. but basically a series of ""kip"" notes, quality differing subtly to markedly among call-note types; for diagnosis, best recorded so sonogram can be analyzed later. Song begins with two-note phrases followed by a warbled trill.",,
440,Fringilline and Curdueline Finches/Allies,Fringillidae,White-winged Crossbill,Loxia leucoptera,17cm,"Distinctive flight call is a rapid series of harsh ""chet"" notes. Variable song, often delivered in display flight, combines harsh rattles and musical warbles. Vocalizations of larger, thicker-billed bifasciata of Eurasia markedly different. Unrecorded N.A.",,
440,Fringilline and Curdueline Finches/Allies,Fringillidae,Oriental Greenfinch,Chloris sinica,15cm,"Call is a nasal ""dzweeee"".",,
442,Fringilline and Curdueline Finches/Allies,Fringillidae,Pine Siskin,Spinus pinus,13cm,"Calls include a harsh rising ""tee-ee"" and, in flight, a harsh, descending ""chee"". Song is similar to American Goldfinch but much huskier.",,
442,Fringilline and Curdueline Finches/Allies,Fringillidae,American Goldfinch,Spinus tristis,13cm,"Song is a lively series of trills, twitters, and ""swee"" notes. Distinctive flight call, ""per-chik-o-ree"".",,
442,Fringilline and Curdueline Finches/Allies,Fringillidae,Lesser Goldfinch,Spinus psaltria,11cm,"Call is a plaintive, kittenlike ""tee-yee"". Song is somewhat similar to American Goldfinch. Frequently imitates other species' calls.",,
442,Fringilline and Curdueline Finches/Allies,Fringillidae,Lawrence's Goldfinch,Spinus lawrencei,12cm,"Call is a bell-like ""tink-ul"". Mixes ""tink"" notes into jumbled, melodious song. Like Lesser, often mimics other species' calls.",,
444,Fringilline and Curdueline Finches/Allies,Fringillidae,Common Redpoll,Acanthis flammea,13cm,"When perched, gives a ""swee-ee-eet"" call; flight call is a dry rattling. Song combines trills and twittering.",,
444,Fringilline and Curdueline Finches/Allies,Fringillidae,Hoary Redpoll,Acanthis hornemanni,14cm,Calls and song similar to Common.,means Common Redpoll here,
444,Fringilline and Curdueline Finches/Allies,Fringillidae,Evening Grosbeak,Coccothraustes vespertinus,20cm,"Loud, strident call is a ""clee-ip"" or ""peeer"". Five groups with differing vocalizations described. Eastern vespertinus has lower pitched and burrier (more trilled) calls. Other four call types from West: three from within range of brooksi (northern Rockies and Cascades, southern Rockies, Sierra Nevada) and montanus (possibly extirpated in U.S.).",,
444,Fringilline and Curdueline Finches/Allies,Fringillidae,Hawfinch,Coccothraustes coccothraustes,18cm,"Call is a loud, explosive ""ptik"".",,
446,Longspurs/Snow Buntings,Calcariidae,Smith's Longspur,Calcarius pictus,16cm,"Typical call is a dry, ticking rattle, harder and sharper than Lapland and McGown's Longspurs. Song, heard in spring migration and on the breeding grounds, is delivered only from the ground or a perch. It consists of rapid, melodious warbles, ending with a vigorous ""wee-chew"".",,
446,Longspurs/Snow Buntings,Calcariidae,Lapland Longspur,Calcarius Iapponicus,16cm,"Song, heard mostly on the breeding grounds, is a rapid warbling, frequently given in short flights. Calls include a musical ""tee-lee-oo"" or ""tee-dle"" and, in flight, a dry rattle distinctively mixed with whistled ""tew"" notes.",,
448,Longspurs/Snow Buntings,Calcariidae,Chestnut-collared Longspur,Calcarius ornatus,15cm,"Song, heard only on breeding grounds, is a pleasant, rapid warble, given in song flight or from a low perch. Distinctive call, a two-syllable ""kittle"", is repeated one or more times. Also gives a soft, high-pitched rattle and a short ""buzz"" call.",,
448,Longspurs/Snow Buntings,Calcariidae,McCown's Longspur,Rhynchophanes mccownii,15cm,"Song, heard only on breeding grounds, is a series of exuberant warbles and twitters, generally given in song flight. Calls include a dry rattle, a little softer and more abrupt than Lapland Longspur; also gives single finchlike notes.",,
450,Longspurs/Snow Buntings,Calcariidae,Snow Bunting,Plectrophenax nivalis,17cm,"Calls include a sharp, whistled ""tew""; a short buzz; and a musical rattle or twitter. Song, heard only on the breeding grounds, is a loud, high-pitched musical warbling.",,
450,Longspurs/Snow Buntings,Calcariidae,McKay's Bunting,Plectrophenax hyperboreus,17cm,Calls and song similar to Snow Bunting.,,
452,Wood Warblers,Parulidae,Ovenbird,Seiurus aurocapilla,15cm,"Typical song is a loud *teacher teacher teacher*, rising in volume. Calls include a sharp, dry ""chip"".",,
452,Wood Warblers,Parulidae,Worm-eating Warbler,Helmitheros vermivorum,13cm,"Song is a series of sharp, dry chip notes, like Chipping Sparrow but faster. Common all is a buzzy ""zeep-zeep""; also a sharp ""chip"".",,
452,Wood Warblers,Parulidae,Louisiana Waterthrush,Parkesia motacilla,15cm,"Call note, a sharp ""chick"", flatter than Northern. Song begins with three or four shrill, slurred descending notes followed by a rapid jumble.",,
452,Wood Warblers,Parulidae,Northern Waterthrush,Parkesia noveboracensis,15cm,"Call, a metallic ""chink"", slightly sharper than Louisiana. Song begins with loud, emphatic notes;ends in lower notes, delivered more rapidly.",,
454,Wood Warblers,Parulidae,Golden-winged Warbler,Vermivora chrysoptera,12cm,"Main song is a soft ""bee-bz-bz-bz""; also gives an alternative song similar to Blue-winged Warbler. Calls also similar to Blue-winged. Hybrid's songs usually sound like one of the parent species.",,
454,Wood Warblers,Parulidae,Blue-winged Warbler,Vermivora cyanoptera,12cm,"Main song is a wheezy ""beee-bzzz"", the second note lower; alternate song is longer and more complex. Call is a dry, sharp ""chip""; in flight, call is a thin ""zit"".",,
456,Wood Warblers,Parulidae,Prothonotary Warbler,Protonotoria citrea,14cm,"Song is a series of loud, ringing ""zweet"" notes; gives a dry chip note and buzzy flight call.",,
456,Wood Warblers,Parulidae,Black-and-white Warbler,Mniotilta varia,13cm,"Song is a long series of high, thin ""wee-see"" notes. Calls include a sharp ""chip"" and high ""seep-seep"".",,
456,Wood Warblers,Parulidae,Swainson's Warbler,Limnothlypis swainsonii,14cm,"Song is a series of thin, slurred whistles like beginning of song of Louisiana Waterthrush; often ends with a rising ""tee-oh"". Various renditions include *whee whee whip-poor-will* or *ooh ooh stepped in poo*. Will usually sing from a branch, but will also sing from the ground. Calls include a loud, dry ""chip"".",,
458,Wood Warblers,Parulidae,Tennessee Warbler,Oreothlypis peregrina,12cm,"Distinctive two- or three-part song; in the three-part version, several rapid two-syllable notes are followed by a few higher single notes, usually ending with a staccato trill. Call is a sharp ""chip""; flight call is a thin ""seet"".",,
458,Wood Warblers,Parulidae,Orange-crowned Warbler,Oreothlypis celata,13cm,"Song is a high-pitched staccato trill, faster in lutescens; quite variable in sordiata. Call note, a somewhat metallic ""chip""; also a thin ""seet"".",,
458,Wood Warblers,Parulidae,Nashville Warbler,Oreothlypis ruficapilla,12cm,"Song of eastern ruficapilla is a series of high ""see-weet"" notes and a lower short trill; call is a dull ""chink"". In ridgwayi, song is sweeter, call is sharper.",,
460,Wood Warblers,Parulidae,Colima Warbler,Oreothlypis crissalis,15cm,Song is a trill similar to Orange-crowned Warbler. Call is a loud note similar to Virginia's but not quite as sharp.,,
460,Wood Warblers,Parulidae,Virginia's Warbler,Oreothlypis virginiae,12cm,"Song is a rapid series of thin notes, often ending with lower notes; call is a sharp ""chink"".",,
460,Wood Warblers,Parulidae,Lucy's Warbler,Oreothlypis luciae,11cm,"Lively song is a short trill followed by lower, whistled notes. Call is a sharp ""chink"".",,
460,Wood Warblers,Parulidae,Crescent-chested Warbler,Oreothlypis superciliosa,11cm,"Call is a high, sharp ""sik"", similar to Orange-crowned Warbler, but softer. Song is a very fast, buzzy trill on one pitch.",,
462,Wood Warblers,Parulidae,Connecticut Warbler,Oporornis agilis,15cm,"Loud, accelerating song repeats a brief seris of explosive ""beech-er"" or ""whip-ity"" notes. Most frequently given call is a buzzy ""zeet"", like Yellow or Blackpoll warbler. Rarely heard call note is a nasal ""chimp"" or ""poitch"".",,
462,Wood Warblers,Parulidae,Mourning Warbler,Geothlypis philadelphia,13cm,"Call is a flat, hollow chip, not unlike one call of Bewick's Wren. Song is a series of slurred two-note phrases followed by two or more lower phrases.",,
462,Wood Warblers,Parulidae,MacGillivray's Warbler,Geothlypis tolmiei,13cm,"Call is a sharp, harsh ""tsik"", distinctly different from Mourning. Two-part song is a buzzy trill ending in a downslur.",,
464,Wood Warblers,Parulidae,Common Yellowthroat,Geothlypis trichas,13cm,"Variable song; one version is loud, rolling ""wichity wichity wichity wich"". Also gives an elaborate flight song on breeding territory. Calls include a raspy ""tidge"".",,
464,Wood Warblers,Parulidae,Gray-crowned Yellowthroat,Geothlypis poliocephala,14cm,"Song is a rich, varied warble; call is a rising ""chee dee"".",,
464,Wood Warblers,Parulidae,Kentucky Warbler,Geothlypis formosa,13cm,"Song is a series of rolling musical notes, ""churry churry churry"", much like Carolina Wren. Call is a low, sharp ""chuck"".",,
464,Wood Warblers,Parulidae,Hooded Warbler,Setophaga citrina,13cm,"Song is loud, musical, whistled variations of ""ta-wit ta-wit ta-wit tee-yo"". Call is a flat, metallic ""chink"".",,
