Page,EnglishCommon,LatinSpecies,Length,Voice,Comment
164,African Pipit,Anthus cinnamomeus,17cm,"(...) gives a slow, dry ""pli-pli-pli"" during its high-flying, undulating and often protracted display flight.",
164,Buffy Pipit,Anthus vaalensis,17cm,"(...) male song is a sparrow-like ""chrrrup-chereeoo"" (...)",
164,Striped Pipit,Anthus lineiventris,18cm,"Unusually for a pipit, it has a lusty thrush-like song (...)",
164,Bushveld Pipit,Anthus caffer,13cm,"(...) with a distinctive ""zweep"" call-note.",
166,Yellow-throated Longclaw,Macronyx croceus,21cm,"(...) it utters its rich, fluting call.",
166,African Pied Wagtail,Motacilla aguimp,20cm,(...) with high-pitched whistled calls (...),
166,Southern Boubou,Laniarius ferrugineus,22cm,(...) give grating alarm calls.,
166,Tropical Boubou,Laniarius major,23cm,Duetting pairs can be distinguished from Southern Boubous by the female's harsh grating call.,
168,Magpie Shrike,Corvinella melanoleuca,45cm,"(...) each uttering loud, mellow whistles (higher pitched in females than males).",
168,Southern White-crowned Shrike,Eurocephalus anguitimens,24cm,"(...) a querulous, rather shrill series of ""kwee"" notes.",
168,Red-backed Shrike,Lanius collurio,18cm,Males start to sing a subdued warbling song (...),
170,Black-backed Puffback,Dryoscopus cubla,17cm,"(...) the male's distinctive click-whistle ""chick-weeo"" call reveals his presence.",
170,Brubru,Nilaus afer,14cm,"Its name comes from the male's song, which starts with a chip, followed by a drawn-out, ringing ""brruuuuu"". The female frequently responds in duet with a higher-pitched, shorter ""eeeu"". Curiously, the male's ""brubru"" call is mainly heard only in summer; in winter it is replaced by a rather shrill ""pipipipipipi..."" call.",
170,Brown-crowned Tchagra,Tchagra australis,18cm,"(...) while uttering a series of rolling, descending notes. Both species also have various grating alarm calls.",
170,Black-crowned Tchagra,Tchagra senegalus,21cm,"(...) its lilting, somewhat mournful, descending 5–6-syllabled song, which sounds uncannily like a human whistling.",
172,Gorgeous Bushshrike,Chlorophoneus viridis,19cm,"(...) males call frequently, giving their presence away with their loud, piercing, two- or three-syllabled call, ""kong-koit"" or ""kong-kong-koit"".",
172,Orange-breasted Bushshrike,Chlorophoneus sulfureopectus,19cm,"(...) males call frequently, a series of short, descending whistles sometimes rendered *coffee, tea, or meeee* that have a ventriloquial quality.",
172,Grey-headed Bushshrike,Malaconotus blanchoti,26cm,"(...) the male's mournful, drawn-out, rather ghostly ""whoooooo"" whistle, which explains its Afrikaans name (literally 'ghost-bird').",
172,Black-throated Wattle-eye,Platysteira peltata,13cm,"(...) their presence given away by their soft rasping ""wichee-wichee-wichee…"" song and aerial display call: ""ptec ptec ptec"".",
174,White-crested Helmetshrike,Prionops plumatus,18cm,(...) their peculiar ratchety call-notes.,
176,Burchell's Starling,Lamprotornis australis,32cm,"The typical call is a throaty ""chreeow"".",
176,Meves's Starling,Lamprotornis mevesii,34cm,(...) with shrill calls (...),
176,Cape Glossy Starling,Lamprotornis nitens,23cm,"a rolling ""whurra-whurra-whurra .."".",
176,Greater Blue-eared Starling,Lamprotornis chalybaeus,22cm,"(...) its whining ""wheeea"" contact call, which is similar to the call of the White-fronted Bee-eater.",
178,Violet-backed Starling,Cinnyricinclus leucogaster,18cm,Song is a series of buzzy whistles.,
178,Red-winged Starling,Onychognathus morio,30cm,"Song is a sweet, whistled ""teoo"" or ""whu-tleoo""; also gives harsh, grating calls.",
178,Red-billed Oxpecker,Buphagus erythrorhynchus,20cm,"(...) it often gives high-pitched ""zit"" or ""tsi"" calls.",
182,Collared Sunbird,Hedydipna collaris,11cm,"(...) the male's excited, tripping little song.",
182,Cape White-eye,Zosterops virens,12cm,"Its loud, sweet, warbling song (...)",
184,Southern Grey-headed Sparrow,Passer diffusus,15cm,Its call is a series of typical sparrow chirps.,
184,Yellow-throated Petronia,Gymnoris superciliaris,16cm,"(...) the sparrow-like but more robust two- or three-syllabled ""chip-chip .."" call (...)",
186,Spectacled Weaver,Ploceus ocularis,16cm,"(...) its call, a descending series of short whistles ""dee-dee-dee-dee-dee …"".",
194,Blue Waxbill,Uraeginthus angolensis,12cm,"Song is a high-pitched ""swee-swee-eer""; contact call is a dry ""trrt"" or ""trrt-trrt-trrt"".",
194,Violet-eared Waxbill,Uraeginthus granatinus,14cm,"Its lilting ""tiu-woo-weee"" call often gives away its presence; contact call is dry ""swee"" or ""swit-it-it-it"".",
194,Common Waxbill,Estrilda astrild,12cm,"(...) calling their dry ""zrt zrt"" contact call; once settled they frustratingly keep out of view. Song is a whirring ""zwee-zwee-zwerrrrr"".",
194,Orange-breasted Waxbill,Amandava subflava,9cm,"Call is a very high-pitched ""zink zink zink"".",
196,African Quailfinch,Ortygospiza atricollis,10cm,"(...) they give their distinctive squeaky ""djink"" or ""djink-jink"" calls.",
200,Yellow-fronted Canary,Crithagra mozambica,12cm,"Often detected by its sweet, lilting song (...)",
202,Streaky-headed Seedeater,Crithagra gularis,15cm,"(...) its melodious, canary-type song.",
202,Golden-breasted Bunting,Emberiza flaviventris,16cm,"Song is a cheerful, loud series of whistles ""weechee, weechee, weechee"".",
202,Cinnamon-breasted Bunting,Emberiza tahapisi,15cm,"The male's short, repetitive refrain (...)",
202,Lark-like Bunting,Emberiza impetuani,15cm,"Song is a repetitive ""chiriri chippy-chirpy-chirip"".",